filename,notes,authors,licenses,urls
body/bodies/male/light.png,"see details at https://opengameart.org/content/lpc-character-bases; 'Thick' Male Revised Run/Climb by JaidynReiman (based on ElizaWy's LPC Revised)","bluecarrot16,JaidynReiman,Benjamin K. Smith (BenCreating),Evert,Eliza Wyatt (ElizaWy),TheraHedwig,MuffinElZangano,Durrani,Johannes Sjölund (wulax),Stephen Challener (Redshrike)","OGA-BY 3.0,CC-BY-SA 3.0,GPL 3.0","https://opengameart.org/content/liberated-pixel-cup-lpc-base-assets-sprites-map-tiles,https://opengameart.org/content/lpc-medieval-fantasy-character-sprites,https://opengameart.org/content/lpc-male-jumping-animation-by-durrani,https://opengameart.org/content/lpc-runcycle-and-diagonal-walkcycle,https://opengameart.org/content/lpc-revised-character-basics,https://opengameart.org/content/lpc-be-seated,https://opengameart.org/content/lpc-runcycle-for-male-muscular-and-pregnant-character-bases-with-modular-heads,https://opengameart.org/content/lpc-jump-expanded,https://opengameart.org/content/lpc-character-bases"
head/heads/human/male/light.png,"original head by Redshrike, tweaks by BenCreating, modular version by bluecarrot16","bluecarrot16,Benjamin K. Smith (BenCreating),Stephen Challener (Redshrike)","OGA-BY 3.0,CC-BY-SA 3.0,GPL 3.0","https://opengameart.org/content/liberated-pixel-cup-lpc-base-assets-sprites-map-tiles,https://opengameart.org/content/lpc-character-bases"
hat/helmet/armet/adult/iron.png,"previously called helmet/armor","bluecarrot16,Johannes Sjölund (wulax)","OGA-BY 3.0,CC-BY-SA 3.0,GPL 3.0","https://opengameart.org/content/lpc-medieval-fantasy-character-sprites,https://opengameart.org/content/lpc-expanded-hats-facial-helmets"
shoulders/legion/male/steel.png,"","Nila122","OGA-BY 3.0,CC-BY-SA 3.0,GPL 2.0,GPL 3.0","https://opengameart.org/content/lpc-roman-armor"
torso/armour/plate/male/iron.png,"original by wulax, recolor by bigbeargames, color reduced to 7 colors and adapted to v3 bases by bluecarrot16, run/jump/sit/climb/revised combat by JaidynReiman","JaidynReiman, bluecarrot16, Michael Whitlock (bigbeargames), Johannes Sjölund (wulax)","OGA-BY 3.0,CC-BY-SA 3.0,GPL 3.0","https://opengameart.org/content/lpc-medieval-fantasy-character-sprites,https://opengameart.org/content/lpc-combat-armor-for-women"
legs/leggings/male/black.png,"Original bases by Redshrike, thrust/shoot bases by Wulax, original overalls by ElizaWy, base animations adapted from v3 overalls by bluecarrot16, leggings by JaidynReiman","bluecarrot16,ElizaWy,JaidynReiman,Mandi Paugh,William.Thompsonj,Johannes Sjölund (wulax),Stephen Challener (Redshrike)","OGA-BY 3.0,GPL 3.0","https://github.com/ElizaWy/LPC/tree/main/Characters/Clothing,https://opengameart.org/content/lpc-expanded-pants"
feet/boots/basic/male/black.png,"original by Nila122, edited for male and v3 bases by bluecarrot16, Jump/Sit/Emote/Run/Revised Combat by JaidynReiman","JaidynReiman,bluecarrot16,Nila122","OGA-BY 3.0,CC-BY-SA 3.0,GPL 2.0,GPL 3.0","https://opengameart.org/content/lpc-clothes-and-hair,https://opengameart.org/content/lpc-expanded-socks-shoes"
weapon/polearm/spear/foreground/iron.png,"original by wulax, walk animations redone by pvigier, split into layers and tweaked for v3 character bases by bluecarrot16","Pierre Vigier (pvigier),Johannes Sjölund (wulax),Inboxninja","CC-BY-SA 3.0","https://opengameart.org/content/lpc-medieval-fantasy-character-sprites,https://opengameart.org/content/lpc-spear-and-shovel-reworked"
weapon/polearm/spear/background/iron.png,"original by wulax, walk animations redone by pvigier, split into layers and tweaked for v3 character bases by bluecarrot16","Pierre Vigier (pvigier),Johannes Sjölund (wulax),Inboxninja","CC-BY-SA 3.0","https://opengameart.org/content/lpc-medieval-fantasy-character-sprites,https://opengameart.org/content/lpc-spear-and-shovel-reworked"
